id,name_id,quote
1,42,The name Aabram is a reminder to us that we are all connected to a greater purpose.
2,47,Aabriella is a beautiful name that means 'gift from God'. It is a perfect name for a child who is a blessing to her parents.
3,47,Aabriella is a strong and independent name that means 'beautiful princess'. It is a perfect name for a child who is confident and knows her own worth.
4,47,Aabriella is a kind and compassionate name that means 'radiant'. It is a perfect name for a child who brings joy to the lives of those around her.
5,58,"Wisdom is not what you know, but what you do."
6,62,Aachman is a name that embodies respect and honor.
7,79,Aadarshini is a beautiful name that reflects the qualities of an ideal woman.
8,79,A woman with the name Aadarshini is sure to be a role model for others.
9,79,The name Aadarshini is a reminder to strive for perfection in all that you do.
10,82,"And as the sun rises, so does hope."
11,82,"The sun is a daily reminder that we too can rise again from the darkness, that we too can shine our own light."
12,114,"Aadharsha is a beautiful name that means ""the goal"" or ""the target."" It is a reminder that we should always strive for our goals and never give up."
13,114,Aadharsha is a perfect name for a child who is destined for great things. It is a name that will inspire them to reach their full potential.
14,132,"A name is a gift, a blessing, and a responsibility."
15,132,"A name is a sound, a vibration, a frequency."
16,132,"A name is a label, a handle, a way to identify ourselves to others."
17,136,"The first step is always the hardest, but it's the one that gets you started."
18,137,The secret of happiness is to let go of what you think you deserve and appreciate what you have.
19,137,The greatest wealth is to live content with little.
20,137,Be kind to unkind people. They need it most.
21,157,Aadhiyan is the light that shines in the darkness.
22,157,Aadhiyan is the source of all creation.
23,157,Aadhiyan is the one who protects us from evil.
24,185,Aadi is a name that is full of life and happiness. It is a name that is perfect for a child who is always smiling and laughing.
25,185,Aadi is a name that is strong and powerful. It is a name that is perfect for a child who is always standing up for what they believe in.
26,185,Aadi is a name that is wise and intelligent. It is a name that is perfect for a child who is always asking questions and learning new things.
27,175,Every new beginning comes from some other beginning's end.
28,175,The beginning is the most important part of the work.
29,175,The beginning of wisdom is the definition of terms.
30,201,"A name is a gift, a precious thing, a treasure to be cherished."
31,201,A name is a powerful thing. It can shape a person's destiny.
32,201,A name is a reflection of the soul.
33,203,"Aadin, you are a unique and powerful individual."
34,203,"You are the master of your own destiny, Aadin."
35,203,"You are capable of great things, Aadin."
